title,url,thumbnail_url,channel,channel_url,views,uploaded,description
"Gervonta Davis KO's Rolando ""Rolly"" Romero in RD6",https://www.youtube.com/watch?v=ktluMBr4VXM,https://i.ytimg.com/vi/ktluMBr4VXM/hqdefault.jpg?sqp=-oaymwEcCPYBEIoBSFXyq4qpAw4IARUAAIhCGAFwAcABBg==&rs=AOn4CLDUrbnF_3sltKBMtYZe0XA1IoyoFA,Premier Boxing Champions,https://www.youtube.com/c/Premierboxingchampions,2.3M views,16 hours ago,"Gervonta Davis said he wanted to deliver punishment to Rolando ""Rolly"" Romero for all the talking he's done in the build up the fight. In RD6 he lands a beautiful left hook that sent Romero..."
Liverpool vs. Real Madrid: Extended Highlights | UCL Final | CBS Sports Golazo,https://www.youtube.com/watch?v=2jrcndaXKJI,https://i.ytimg.com/vi/2jrcndaXKJI/hqdefault.jpg?sqp=-oaymwEcCPYBEIoBSFXyq4qpAw4IARUAAIhCGAFwAcABBg==&rs=AOn4CLCHEXTFNYngp-05bnswxm2GhiJaHg,CBS Sports Golazo,https://www.youtube.com/c/cbssportsgolazo,1.1M views,23 hours ago,"Extended Highlights, Presented By Heineken Two of Europe’s most legendary clubs face off in Paris for its most prestigious prize as Mo Salah leads out Liverpool versus Karim Benzema and..."
"Gervonta Davis Said He ""Didn't Even Throw That Hard"" On Romero KO Punch | SHOWTIME PPV",https://www.youtube.com/watch?v=6zaQCau4KH0,https://i.ytimg.com/vi/6zaQCau4KH0/hqdefault.jpg?sqp=-oaymwEcCPYBEIoBSFXyq4qpAw4IARUAAIhCGAFwAcABBg==&rs=AOn4CLCecIjeRX2J1j-UrMj5KDgQszcBRA,SHOWTIME Sports,https://www.youtube.com/c/SHOSports,1.1M views,16 hours ago,"After knocking out Rolly Romero, Gervonta Davis spoke with Jim Gray about his big win, future plans, and his power. #showtime #showtimeppv #boxing #gervontadavis Don't miss out on the action!..."
ROLLY ROMERO IMMEDIATE REACTION AFTER KNOCKOUT LOSS TO GERVONTA DAVIS; WANTS REMATCH ASAP,https://www.youtube.com/watch?v=-4fSxhT1lqo,,FightHype.com,https://www.youtube.com/c/fighthype,730K views,15 hours ago,"Multi-division world champion Gervonta Davis and top lightweight contender Rolly Romero faced off in their highly-anticipated May 28 showdown at Barclays Center in Brooklyn, New York. You don't..."
"Film Theory: Encanto, The Madrigal Family SECRET!",https://www.youtube.com/watch?v=vRR0NzkVUq4,,The Film Theorists,https://www.youtube.com/c/FilmTheorists,1.2M views,1 day ago,"Get your Theory Wear! ► https://theorywear.com/ By the end of Encanto, we see Dolores united with her prince charming - or at least that is what it seems like from the outside. Theorists,..."
Minecraft NOOB vs PRO: LONGEST STAIRCASE BUILD CHALLENGE,https://www.youtube.com/watch?v=eqZ_E9nKdoM,,Maizen,https://www.youtube.com/channel/UCJHBJ7F-nAIlMGolm0Hu4vg,2.6M views,1 day ago,"Today, we're going head-to-head in a staircase building competition! The goal is to create the toughest, most difficult staircase into the sky! Who's staircase was your favorite? We hope..."
Moneybagg Yo - See Wat I’m Sayin [Official Music Video],https://www.youtube.com/watch?v=eXVaJDG0DNA,,MoneyBagg Yo,https://www.youtube.com/channel/UCrdPrDuDCbG8xayk5QkRLQA,2M views,2 days ago,“See Wat I’m Sayin” Out Now: http://MoneybaggYo.lnk.to/SeeWatImSayin Follow Moneybagg Yo: https://www.instagram.com/moneybaggyo/ https://twitter.com/moneybaggyo https://www.facebook.com/mo...
OFFLINETV DRINKS WATER,https://www.youtube.com/watch?v=mbxtaGuOp2w,,OfflineTV,https://www.youtube.com/c/OfflineTVgg,705K views,1 day ago,Stay hydrated 💦 Use code OFFLINETV16 for up to 16 FREE MEALS + 3 Surprise Gifts across 6 HelloFresh boxes plus free shipping at https://bit.ly/3JhWCv6! -----------------------------------------...
I MOVED TO JAPAN,https://www.youtube.com/watch?v=G2X4U0EqHdc,,Emirichu,https://www.youtube.com/c/Emirichu,989K views,1 day ago,Check out Honkai: Star Rail here! : https://hoyo.link/2a8c2DA6 Pre-register to get a chance to try out the beta and a PlayStation 5! Gamersupps Collab Countdown: https://gamersupps.gg/products/wa...
Star Wars Jedi: Survivor - Official Teaser,https://www.youtube.com/watch?v=4HLDaBGdnLc,,EA Star Wars,https://www.youtube.com/c/EAStarWars,3.2M views,2 days ago,"“What is your next move, Jedi?” Experience the next chapter of Cal Kestis’ journey in STAR WARS Jedi: Survivor - coming in 2023. Picking up five years after the events of STAR WARS..."
